{
  "$schema": "http://json-schema.org/draft-04/schema#",
  "type": "object",
  "properties": {
    "AttackTypes": {
      "type": "array",
      "items": {
        "type": "object",
        "properties": {
          "Type": {
            "type": "string"
          },
          "MTDSolutions": {
            "type": "array",
            "items": {
              "type": "object",
              "properties": {
                "Priority": {
                  "type": "integer"
                },
                "ScriptName": {
                  "type": "string"
                },
                "AbsolutePath": {
                  "type": "string"
                },
                "RunWithPrefix": {
                  "type": "string"
                },
                "Params": {
                  "type": "string"
                }
              },
              "required": [
                "Priority",
                "ScriptName",
                "AbsolutePath",
                "RunWithPrefix"
              ]
            }
          },
          "DeploymentPolicy": {
            "type": "object",
            "properties": {
              "ScriptName": {
                "type": "string"
              },
              "AbsolutePath": {
                "type": "string"
              },
              "RunWithPrefix": {
                "type": "string"
              }
            },
            "required": [
              "ScriptName",
              "AbsolutePath",
              "RunWithPrefix"
            ]
          }
        },
        "required": [
          "Type",
          "MTDSolutions"
        ]
      }
    },
    "AllowAllExternalReports": {
      "type": "boolean"
    },
    "WhiteListForExternalReports": {
      "type": "array",
      "items": {
        "type": "string"
      }
    },
    "PortToUse": {
      "type": "integer"
    }
  },
  "required": [
    "AttackTypes",
    "AllowAllExternalReports",
    "WhiteListForExternalReports",
    "PortToUse"
  ]
}