{
  "AttackTypes": [
    {
      "Type": "CnC",
      "MTDSolutions": [
        {
          "Priority": 1,
          "ScriptName": "ChangeIpAddress.py",
          "AbsolutePath": "/opt/MTDFramework/CnC/",
          "RunWithPrefix": "python3"
        }
      ]
    },
    {
      "Type": "Rootkit",
      "MTDSolutions": [
        {
          "Priority": 1,
          "ScriptName": "RemoveRootkit.py",
          "AbsolutePath": "/opt/MTDFramework/Rootkit/",
          "RunWithPrefix": "python3"
        }
      ]
    },
    {
      "Type": "Ransomware",
      "MTDSolutions": [
        {
          "Priority": 1,
          "ScriptName": "CreateDummyFiles.py",
          "AbsolutePath": "/opt/MTDFramework/Ransomware/",
          "RunWithPrefix": "python3",
          "Params": "--path /home/ --numberOfDummyFiles 30 --numberOfDummyFilesPerSubdirectory 15 --size 10 --extension pdf"
        },
        {
          "Priority": 2,
          "ScriptName": "ChangeFileTypes.py",
          "AbsolutePath": "/opt/MTDFramework/Ransomware/",
          "RunWithPrefix": "python3",
          "Params": "--path /home/ --extensions pdf png so docx --recursive"
        }

      ]
    }
  ],
  "AllowAllExternalReports": false,
  "WhiteListForExternalReports": [],
  "PortToUse": 1234
}
